{"codexVersion":"0.145.0","entries":[{"direction":"client-request","disposition":"schema-validated-unexercised","method":"account/login/cancel","observedCount":0,"rationale":"Present in the pinned stable schema but not observed in the Phase 1 baseline."},{"direction":"client-request","disposition":"schema-validated-unexercised","method":"account/login/start","observedCount":0,"rationale":"Present in the pinned stable schema but not observed in the Phase 1 baseline."},{"direction":"client-request","disposition":"schema-validated-unexercised","method":"account/logout","observedCount":0,"rationale":"Present in the pinned stable schema but not observed in the Phase 1 baseline."},{"direction":"client-request","disposition":"schema-validated-unexercised","method":"account/rateLimitResetCredit/consume","observedCount":0,"rationale":"Present in the pinned stable schema but not observed in the Phase 1 baseline."},{"direction":"client-request","disposition":"schema-validated-unexercised","method":"account/rateLimits/read","observedCount":0,"rationale":"Present in the pinned stable schema but not observed in the Phase 1 baseline."},{"direction":"client-request","disposition":"exercised","method":"account/read","observedCount":1,"rationale":"Observed as a schema-valid record in the bidirectional protocol journal."},{"direction":"client-request","disposition":"schema-validated-unexercised","method":"account/sendAddCreditsNudgeEmail","observedCount":0,"rationale":"Present in the pinned stable schema but not observed in the Phase 1 baseline."},{"direction":"client-request","disposition":"schema-validated-unexercised","method":"account/usage/read","observedCount":0,"rationale":"Present in the pinned stable schema but not observed in the Phase 1 baseline."},{"direction":"client-request","disposition":"schema-validated-unexercised","method":"account/workspaceMessages/read","observedCount":0,"rationale":"Present in the pinned stable schema but not observed in the Phase 1 baseline."},{"direction":"client-request","disposition":"schema-validated-unexercised","method":"app/installed","observedCount":0,"rationale":"Present in the pinned stable schema but not observed in the Phase 1 baseline."},{"direction":"client-request","disposition":"schema-validated-unexercised","method":"app/list","observedCount":0,"rationale":"Present in the pinned stable schema but not observed in the Phase 1 baseline."},{"direction":"client-request","disposition":"schema-validated-unexercised","method":"app/read","observedCount":0,"rationale":"Present in the pinned stable schema but not observed in the Phase 1 baseline."},{"direction":"client-request","disposition":"schema-validated-unexercised","method":"command/exec","observedCount":0,"rationale":"Present in the pinned stable schema but not observed in the Phase 1 baseline."},{"direction":"client-request","disposition":"schema-validated-unexercised","method":"command/exec/resize","observedCount":0,"rationale":"Present in the pinned stable schema but not observed in the Phase 1 baseline."},{"direction":"client-request","disposition":"schema-validated-unexercised","method":"command/exec/terminate","observedCount":0,"rationale":"Present in the pinned stable schema but not observed in the Phase 1 baseline."},{"direction":"client-request","disposition":"schema-validated-unexercised","method":"command/exec/write","observedCount":0,"rationale":"Present in the pinned stable schema but not observed in the Phase 1 baseline."},{"direction":"client-request","disposition":"schema-validated-unexercised","method":"config/batchWrite","observedCount":0,"rationale":"Present in the pinned stable schema but not observed in the Phase 1 baseline."},{"direction":"client-request","disposition":"schema-validated-unexercised","method":"config/mcpServer/reload","observedCount":0,"rationale":"Present in the pinned stable schema but not observed in the Phase 1 baseline."},{"direction":"client-request","disposition":"schema-validated-unexercised","method":"config/read","observedCount":0,"rationale":"Present in the pinned stable schema but not observed in the Phase 1 baseline."},{"direction":"client-request","disposition":"schema-validated-unexercised","method":"config/value/write","observedCount":0,"rationale":"Present in the pinned stable schema but not observed in the Phase 1 baseline."},{"direction":"client-request","disposition":"schema-validated-unexercised","method":"configRequirements/read","observedCount":0,"rationale":"Present in the pinned stable schema but not observed in the Phase 1 baseline."},{"direction":"client-request","disposition":"schema-validated-unexercised","method":"experimentalFeature/enablement/set","observedCount":0,"rationale":"Present in the pinned stable schema but not observed in the Phase 1 baseline."},{"direction":"client-request","disposition":"schema-validated-unexercised","method":"experimentalFeature/list","observedCount":0,"rationale":"Present in the pinned stable schema but not observed in the Phase 1 baseline."},{"direction":"client-request","disposition":"schema-validated-unexercised","method":"externalAgentConfig/detect","observedCount":0,"rationale":"Present in the pinned stable schema but not observed in the Phase 1 baseline."},{"direction":"client-request","disposition":"schema-validated-unexercised","method":"externalAgentConfig/import","observedCount":0,"rationale":"Present in the pinned stable schema but not observed in the Phase 1 baseline."},{"direction":"client-request","disposition":"schema-validated-unexercised","method":"externalAgentConfig/import/readHistories","observedCount":0,"rationale":"Present in the pinned stable schema but not observed in the Phase 1 baseline."},{"direction":"client-request","disposition":"schema-validated-unexercised","method":"feedback/upload","observedCount":0,"rationale":"Present in the pinned stable schema but not observed in the Phase 1 baseline."},{"direction":"client-request","disposition":"schema-validated-unexercised","method":"fs/copy","observedCount":0,"rationale":"Present in the pinned stable schema but not observed in the Phase 1 baseline."},{"direction":"client-request","disposition":"schema-validated-unexercised","method":"fs/createDirectory","observedCount":0,"rationale":"Present in the pinned stable schema but not observed in the Phase 1 baseline."},{"direction":"client-request","disposition":"schema-validated-unexercised","method":"fs/getMetadata","observedCount":0,"rationale":"Present in the pinned stable schema but not observed in the Phase 1 baseline."},{"direction":"client-request","disposition":"schema-validated-unexercised","method":"fs/readDirectory","observedCount":0,"rationale":"Present in the pinned stable schema but not observed in the Phase 1 baseline."},{"direction":"client-request","disposition":"schema-validated-unexercised","method":"fs/readFile","observedCount":0,"rationale":"Present in the pinned stable schema but not observed in the Phase 1 baseline."},{"direction":"client-request","disposition":"schema-validated-unexercised","method":"fs/remove","observedCount":0,"rationale":"Present in the pinned stable schema but not observed in the Phase 1 baseline."},{"direction":"client-request","disposition":"schema-validated-unexercised","method":"fs/unwatch","observedCount":0,"rationale":"Present in the pinned stable schema but not observed in the Phase 1 baseline."},{"direction":"client-request","disposition":"schema-validated-unexercised","method":"fs/watch","observedCount":0,"rationale":"Present in the pinned stable schema but not observed in the Phase 1 baseline."},{"direction":"client-request","disposition":"schema-validated-unexercised","method":"fs/writeFile","observedCount":0,"rationale":"Present in the pinned stable schema but not observed in the Phase 1 baseline."},{"direction":"client-request","disposition":"schema-validated-unexercised","method":"fuzzyFileSearch","observedCount":0,"rationale":"Present in the pinned stable schema but not observed in the Phase 1 baseline."},{"direction":"client-request","disposition":"schema-validated-unexercised","method":"hooks/list","observedCount":0,"rationale":"Present in the pinned stable schema but not observed in the Phase 1 baseline."},{"direction":"client-request","disposition":"exercised","method":"initialize","observedCount":1,"rationale":"Observed as a schema-valid record in the bidirectional protocol journal."},{"direction":"client-request","disposition":"schema-validated-unexercised","method":"marketplace/add","observedCount":0,"rationale":"Present in the pinned stable schema but not observed in the Phase 1 baseline."},{"direction":"client-request","disposition":"schema-validated-unexercised","method":"marketplace/remove","observedCount":0,"rationale":"Present in the pinned stable schema but not observed in the Phase 1 baseline."},{"direction":"client-request","disposition":"schema-validated-unexercised","method":"marketplace/upgrade","observedCount":0,"rationale":"Present in the pinned stable schema but not observed in the Phase 1 baseline."},{"direction":"client-request","disposition":"schema-validated-unexercised","method":"mcpServer/oauth/login","observedCount":0,"rationale":"Present in the pinned stable schema but not observed in the Phase 1 baseline."},{"direction":"client-request","disposition":"schema-validated-unexercised","method":"mcpServer/resource/read","observedCount":0,"rationale":"Present in the pinned stable schema but not observed in the Phase 1 baseline."},{"direction":"client-request","disposition":"schema-validated-unexercised","method":"mcpServer/tool/call","observedCount":0,"rationale":"Present in the pinned stable schema but not observed in the Phase 1 baseline."},{"direction":"client-request","disposition":"schema-validated-unexercised","method":"mcpServerStatus/list","observedCount":0,"rationale":"Present in the pinned stable schema but not observed in the Phase 1 baseline."},{"direction":"client-request","disposition":"exercised","method":"m